{
  "format": "aamp.offload_task/1",
  "id": "yellow-fix-token-count-fallback",
  "intent": "Fix the rough token-count fallback in local_executor.py so it never returns 0 for non-empty text when tiktoken is unavailable. Done when the fallback returns at least 1 for any non-empty string and the new behaviour is covered by a test.",
  "context_pointers": ["runtime/benny/core/local_executor.py:count_tokens"],
  "acceptance_criteria": [
    { "id": "ac1", "statement": "count_tokens returns >=1 for any non-empty input even with tiktoken disabled." },
    { "id": "ac2", "statement": "Existing token-count tests still pass.", "verify": "pytest runtime/tests -k token -q" },
    { "id": "ac3", "statement": "A regression test for the non-empty fallback is added." }
  ],
  "risk_tier": "yellow",
  "executor": {
    "mode": "generate",
    "model": "lemonade/qwen3-tk-4b-FLM",
    "prompt": "Implement the fix described in the intent. Return a unified diff limited to allowed_paths plus the new test."
  },
  "eval_plan": {
    "deterministic": ["pytest runtime/tests -k token -q"],
    "judge": { "enabled": true, "model": "lemonade/Qwen2.5-0.5B-Instruct-CPU", "pass_threshold": 0.8 }
  },
  "allowed_paths": ["runtime/benny/core/local_executor.py", "runtime/tests/**"],
  "budget": { "max_iterations": 3, "max_seconds": 1200 },
  "escalation_policy": "on_low_confidence",
  "workspace": "default"
}
