{
  "format": "aamp.offload_task/1",
  "id": "green-docstrings-rag-routes",
  "intent": "Add missing module + function docstrings to runtime/benny/api/rag_routes.py without changing any behaviour. Done when every public function has a one-line docstring and the file still imports and lints clean.",
  "context_pointers": ["runtime/benny/api/rag_routes.py"],
  "acceptance_criteria": [
    {
      "id": "ac1",
      "statement": "File still parses and imports.",
      "verify": "python -c \"import ast,sys; ast.parse(open('runtime/benny/api/rag_routes.py').read())\""
    },
    {
      "id": "ac2",
      "statement": "Ruff reports no errors.",
      "verify": "ruff check runtime/benny/api/rag_routes.py"
    }
  ],
  "risk_tier": "green",
  "executor": {
    "mode": "generate",
    "model": "lemonade/Qwen3-Coder-4B",
    "prompt": "Add concise one-line docstrings to every public function and the module in the referenced file. Do not change any logic. Return the full updated file."
  },
  "eval_plan": {
    "deterministic": [
      "python -c \"import ast; ast.parse(open('runtime/benny/api/rag_routes.py').read())\"",
      "ruff check runtime/benny/api/rag_routes.py"
    ],
    "judge": { "enabled": false }
  },
  "allowed_paths": ["runtime/benny/api/rag_routes.py"],
  "budget": { "max_iterations": 2, "max_seconds": 600 },
  "escalation_policy": "on_fail",
  "workspace": "default"
}
